content,topic,label
"  The capturing groups correspond to the rules given above, along with the invalid placeholder rule: The methods on this class will raise ValueError if the pattern matches the template without one of these named groups matching",String,2
 Format specifications are used within replacement fields contained within a format string to define how individual values are presented (see Format String Syntax and Formatted string literals),String,2
 They can also be passed directly to the built-in format() function,String,2
  Each formattable type may define how the format specification is to be interpreted,String,2
" Most built-in types implement the following options for format specifications, although some of the formatting options are only supported by the numeric types",String,2
 A general convention is that an empty format specification produces the same result as if you had called str() on the value,String,2
 A non-empty format specification typically modifies the result,String,2
" The general form of a standard format specifier is: If a valid align value is specified, it can be preceded by a fill character that can be any character and defaults to a space if omitted",String,2
 It is not possible to use a literal curly brace ({ or }) as the fill character in a formatted string literal or when using the str,String,2
format() method,String,2
"  However, it is possible to insert a curly brace with a nested replacement field",String,2
  This limitation doesnt affect the format() function,String,2
" The meaning of the various alignment options is as follows: Note that unless a minimum field width is defined, the field width will always be the same size as the data to fill it, so that the alignment option has no meaning in this case",String,2
" The sign option is only valid for number types, and can be one of the following: The 'z' option coerces negative zero floating-point values to positive zero after rounding to the format precision",String,2
  This option is only valid for floating-point presentation types,String,2
 The '#' option causes the alternate form to be used for the conversion,String,2
  The alternate form is defined differently for different types,String,2
"  This option is only valid for integer, float and complex types",String,2
" For integers, when binary, octal, or hexadecimal output is used, this option adds the respective prefix '0b', '0o', '0x', or '0X' to the output value",String,2
" For float and complex the alternate form causes the result of the conversion to always contain a decimal-point character, even if no digits follow it",String,2
" Normally, a decimal-point character appears in the result of these conversions only if a digit follows it",String,2
" In addition, for 'g' and 'G' conversions, trailing zeros are not removed from the result",String,2
" The ',' option signals the use of a comma for a thousands separator",String,2
" For a locale aware separator, use the 'n' integer presentation type instead",String,2
 The '_' option signals the use of an underscore for a thousands separator for floating point presentation types and for integer presentation type 'd',String,2
"  For integer presentation types 'b', 'o', 'x', and 'X', underscores will be inserted every 4 digits",String,2
"  For other presentation types, specifying this option is an error",String,2
" width is a decimal integer defining the minimum total field width, including any prefixes, separators, and other formatting characters",String,2
" If not specified, then the field width will be determined by the content",String,2
" When no explicit alignment is given, preceding the width field by a zero ('0') character enables sign-aware zero-padding for numeric types",String,2
  This is equivalent to a fill character of '0' with an alignment type of '=',String,2
" The precision is a decimal integer indicating how many digits should be displayed after the decimal point for presentation types 'f' and 'F', or before and after the decimal point for presentation types 'g' or 'G'",String,2
"  For string presentation types the field indicates the maximum field size - in other words, how many characters will be used from the field content",String,2
  The precision is not allowed for integer presentation types,String,2
" Finally, the type determines how the data should be presented",String,2
" The available string presentation types are: The available integer presentation types are: In addition to the above presentation types, integers can be formatted with the floating point presentation types listed below (except 'n' and None)",String,2
" When doing so, float() is used to convert the integer to a floating point number before formatting",String,2
 The available presentation types for float and Decimal values are: This section contains examples of the str,String,2
format() syntax and comparison with the old %-formatting,String,2
" In most of the cases the syntax is similar to the old %-formatting, with the addition of the {} and with : used instead of %",String,2
" For example, '%03",String,2
2f' can be translated to '{:03,String,2
2f}',String,2
" The new format syntax also supports new and different options, shown in the following examples",String,2
" Accessing arguments by position: Accessing arguments by name: Accessing arguments attributes: Accessing arguments items: Replacing %s and %r: Aligning the text and specifying a width: Replacing %+f, %-f, and % f and specifying a sign: Replacing %x and %o and converting the value to different bases: Using the comma as a thousands separator: Expressing a percentage: Using type-specific formatting: Nesting arguments and more complex examples:",String,2
" A regular expression (or RE) specifies a set of strings that matches it; the functions in this module let you check if a particular string matches a given regular expression (or if a given regular expression matches a particular string, which comes down to the same thing)",regex,3
" Regular expressions can be concatenated to form new regular expressions; if A and B are both regular expressions, then AB is also a regular expression",regex,3
" In general, if a string p matches A and another string q matches B, the string pq will match AB",regex,3
  This holds unless A or B contain low precedence operations; boundary conditions between A and B; or have numbered group references,regex,3
"  Thus, complex expressions can easily be constructed from simpler primitive expressions like the ones described here",regex,3
"  For details of the theory and implementation of regular expressions, consult the Friedl book [Frie09], or almost any textbook about compiler construction",regex,3
 A brief explanation of the format of regular expressions follows,regex,3
"  For further information and a gentler presentation, consult the Regular Expression HOWTO",regex,3
 Regular expressions can contain both special and ordinary characters,regex,3
" Most ordinary characters, like 'A', 'a', or '0', are the simplest regular expressions; they simply match themselves",regex,3
"  You can concatenate ordinary characters, so last matches the string 'last'",regex,3
"  (In the rest of this section, well write REs in this special style, usually without quotes, and strings to be matched 'in single quotes'",regex,3
") Some characters, like '|' or '(', are special",regex,3
" Special characters either stand for classes of ordinary characters, or affect how the regular expressions around them are interpreted",regex,3
" Repetition operators or quantifiers (*, +, ?, {m,n}, etc) cannot be directly nested",regex,3
" This avoids ambiguity with the non-greedy modifier suffix ?, and with other modifiers in other implementations",regex,3
" To apply a second repetition to an inner repetition, parentheses may be used",regex,3
" For example, the expression (?:a{6})* matches any multiple of six 'a' characters",regex,3
 The special characters are: The special sequences consist of '\' and a character from the list below,regex,3
" If the ordinary character is not an ASCII digit or an ASCII letter, then the resulting RE will match the second character",regex,3
"  For example, \$ matches the character '$'",regex,3
" Most of the standard escapes supported by Python string literals are also accepted by the regular expression parser: (Note that \b is used to represent word boundaries, and means backspace only inside character classes",regex,3
") ' ', '\U', and '\N' escape sequences are only recognized in Unicode patterns",regex,3
  In bytes patterns they are errors,regex,3
  Unknown escapes of ASCII letters are reserved for future use and treated as errors,regex,3
 Octal escapes are included in a limited form,regex,3
"  If the first digit is a 0, or if there are three octal digits, it is considered an octal escape",regex,3
" Otherwise, it is a group reference",regex,3
"  As for string literals, octal escapes are always at most three digits in length",regex,3
" The module defines several functions, constants, and an exception",regex,3
 Some of the functions are simplified versions of the full featured methods for compiled regular expressions,regex,3
  Most non-trivial applications always use the compiled form,regex,3
 Compiled regular expression objects support the following methods and attributes: Match objects always have a boolean value of True,regex,3
" Since match() and search() return None when there is no match, you can test whether there was a match with a simple if statement: Match objects support the following methods and attributes:",regex,3
